{
  "version": "1.0.0",
  "precedence": ["hard", "project", "user", "default"],
  "defaults": {
    "response_style": "detailed",
    "examples": "often",
    "emoji": "allowed",
    "comment_style": "descriptive",
    "spacing": "liberal",
    "paradigm": "mixed",
    "testing_required": false,
    "version_control": "minimal"
  },
  "user": {
    "response_style": "concise",
    "examples": "only_when_requested",
    "emoji": "never",
    "comment_style": "descriptive",
    "spacing": "minimal",
    "paradigm": "functional",
    "testing_required": true,
    "version_control": "active"
  },
  "project": {},
  "hard": {
    "emoji": "never"
  },
  "effective": {
    "response_style": "concise",
    "examples": "only_when_requested",
    "emoji": "never",
    "comment_style": "descriptive",
    "spacing": "minimal",
    "paradigm": "functional",
    "testing_required": true,
    "version_control": "active"
  }
}
